{
    "project_id": "test_golden_001",
    "version": "1.0",
    "source_video": "test_video.mp4",
    "rooms": [
        {
            "id": "room_001",
            "name": "Living Room",
            "type": "living",
            "dimensions": {
                "width": 5.0,
                "length": 6.0,
                "height": 2.8
            },
            "pois": [
                {"id": "poi_001", "type": "sofa", "position": [2.5, 3.0, 0.4]},
                {"id": "poi_002", "type": "table", "position": [2.5, 1.5, 0.4]}
            ]
        }
    ],
    "camera_path": {
        "type": "linear",
        "keyframes": [
            {"frame": 0, "position": [0, 0, 1.6], "rotation": [90, 0, 0]},
            {"frame": 60, "position": [5, 0, 1.6], "rotation": [90, 0, 0]}
        ]
    },
    "metadata": {
        "duration_sec": 60,
        "fps": 24,
        "resolution": [1920, 1080]
    }
}
